{
  "required" : true ,
  "$schema" : "http://json-schema.org/draft-03/schema" ,
  "type" : "object" ,
  "properties" : {
    "self" : {
      "type" : "string" ,
      "required" : false
    } ,
    "votes" : {
      "type" : "number" ,
      "required" : false
    } ,
    "hasVoted" : {
      "type" : "boolean" ,
      "required" : false
    } ,
    "voters" : {
      "type" : "array" ,
      "required" : false ,
      "items" : [
        {
          "type" : "object" ,
          "properties" : {
            "self" : {
              "type" : "string" ,
              "required" : false
            } ,
            "name" : {
              "type" : "string" ,
              "required" : false
            } ,
            "avatarUrls" : {
              "type" : "object" ,
              "required" : false ,
              "properties" : {
                "24x24" : {
                  "type" : "string" ,
                  "required" : false
                } ,
                "16x16" : {
                  "type" : "string" ,
                  "required" : false
                } ,
                "32x32" : {
                  "type" : "string" ,
                  "required" : false
                } ,
                "48x48" : {
                  "type" : "string" ,
                  "required" : false
                }
              }
            } ,
            "displayName" : {
              "type" : "string" ,
              "required" : false
            } ,
            "active" : {
              "type" : "boolean" ,
              "required" : false
            }
          }
        }
      ]
    }
  }
}