{
  "self" : "http://www.example.com/jira/rest/api/issue/MKY-1/votes" ,
  "votes" : 24 ,
  "hasVoted" : true ,
  "voters" : [
    {
      "self" : "http://www.example.com/jira/rest/api/2/user?username=fred" ,
      "name" : "fred" ,
      "avatarUrls" : {
        "24x24" : "http://www.example.com/jira/secure/useravatar?size=small&ownerId=fred" ,
        "16x16" : "http://www.example.com/jira/secure/useravatar?size=xsmall&ownerId=fred" ,
        "32x32" : "http://www.example.com/jira/secure/useravatar?size=medium&ownerId=fred" ,
        "48x48" : "http://www.example.com/jira/secure/useravatar?size=large&ownerId=fred"
      } ,
      "displayName" : "Fred F. User" ,
      "active" : false
    }
  ]
}